id,title,score,num_comments,created_utc,url,author,upvote_ratio,over_18,edited,spoiler,stickied
1qi7quj,Spending >70% of my time not coding/building - is this the norm at big corps?,84,27,2026-01-20 17:40:10,https://www.reddit.com/r/dataengineering/comments/1qi7quj/spending_70_of_my_time_not_codingbuilding_is_this/,HiddenStanLeeCameo,0.97,False,False,False,False
1qi4bp2,Any Other Seniors Struggling in the Job Market Right Now?,68,38,2026-01-20 15:37:11,https://www.reddit.com/r/dataengineering/comments/1qi4bp2/any_other_seniors_struggling_in_the_job_market/,shittyfuckdick,0.93,False,False,False,False
1qig8ea,Senior DE on on-prem + SQL only — how bad is that?,34,18,2026-01-20 22:47:07,https://www.reddit.com/r/dataengineering/comments/1qig8ea/senior_de_on_onprem_sql_only_how_bad_is_that/,Educational_Ad4133,0.96,False,False,False,False
1qilwgb,Airflow Best Practice Reality?,16,20,2026-01-21 02:45:18,https://www.reddit.com/r/dataengineering/comments/1qilwgb/airflow_best_practice_reality/,BeardedYeti_,0.88,False,False,False,False
1qi76hy,Feel too old for a career change to DE,17,29,2026-01-20 17:20:14,https://www.reddit.com/r/dataengineering/comments/1qi76hy/feel_too_old_for_a_career_change_to_de/,eatmyass87,0.88,False,False,False,False
1qicj6k,I am a data engineer with 2+ years of experience making 63k a year. What are my options?,16,32,2026-01-20 20:29:41,https://www.reddit.com/r/dataengineering/comments/1qicj6k/i_am_a_data_engineer_with_2_years_of_experience/,Willgetyoukilled,0.72,False,False,False,False
1qi0z60,How to prevent spark dataset long running loops from stopping (Spark 3.5+),13,6,2026-01-20 13:23:14,https://www.reddit.com/r/dataengineering/comments/1qi0z60/how_to_prevent_spark_dataset_long_running_loops/,Efficient_Agent_2048,0.9,False,False,False,False
1qisbbq,How did you land your first Data Engineer role when they all require 2-3 years of experience?,11,15,2026-01-21 08:18:16,https://www.reddit.com/r/dataengineering/comments/1qisbbq/how_did_you_land_your_first_data_engineer_role/,Such-Revolution-9975,0.82,False,False,False,False
1qirtu3,What resources or tutorials helped you get the most advanced knowledge of Polars?,7,4,2026-01-21 07:48:50,https://www.reddit.com/r/dataengineering/comments/1qirtu3/what_resources_or_tutorials_helped_you_get_the/,asuzybdozy,0.89,False,False,False,False
1qifo47,How do teams handle environments and schema changes across multiple data teams?,6,2,2026-01-20 22:25:30,https://www.reddit.com/r/dataengineering/comments/1qifo47/how_do_teams_handle_environments_and_schema/,TheOnlinePolak,1.0,False,False,False,False
1qhzxaw,Anybody using Hex / Omni / Sigma / Evidence?,5,10,2026-01-20 12:34:20,https://www.reddit.com/r/dataengineering/comments/1qhzxaw/anybody_using_hex_omni_sigma_evidence/,finally_i_found_one,0.86,False,False,False,False
1qie1ih,Would you recommend running airflow in Kubernetes (Spot),5,0,2026-01-20 21:24:47,https://www.reddit.com/r/dataengineering/comments/1qie1ih/would_you_recommend_running_airflow_in_kubernetes/,SnooPickles792,1.0,False,False,False,False
1qidvaz,3yoe SAS-based DE experience - how to position myself for modern DE roles? (EU),4,2,2026-01-20 21:18:35,https://www.reddit.com/r/dataengineering/comments/1qidvaz/3yoe_sasbased_de_experience_how_to_position/,1nsaneCreator,0.71,False,False,False,False
1qisvk1,Help me pick my free cert please!,2,2,2026-01-21 08:53:55,https://www.reddit.com/r/dataengineering/comments/1qisvk1/help_me_pick_my_free_cert_please/,PPEverythingg,0.75,False,False,False,False
1qib5fr,Hardware engineering for Data Eng,2,1,2026-01-20 19:39:25,https://www.reddit.com/r/dataengineering/comments/1qib5fr/hardware_engineering_for_data_eng/,codek1,1.0,False,False,False,False
1qi6yc8,Crit cloud native data ingestion diagram,2,2,2026-01-20 17:12:01,https://www.reddit.com/r/dataengineering/comments/1qi6yc8/crit_cloud_native_data_ingestion_diagram/,laeuftt,0.76,False,False,False,False
1qichn4,What degree should I pursue in college? If I’m interested in “one” day becoming a data engineer,0,8,2026-01-20 20:28:05,https://www.reddit.com/r/dataengineering/comments/1qichn4/what_degree_should_i_pursue_in_college_if_im/,ChickennnBurger,0.44,False,False,False,False
